{
  "schemaVersion": "exec-plan/v2",
  "contractId": "exec-plan.v2",
  "planId": "spec-kit-001-reservation-approval-bridge",
  "title": "Spec Kit bridge import for Reservation Approval",
  "lifecycle": "preview",
  "intent": {
    "summary": "Import Spec Kit feature Reservation Approval into ae-framework assurance review inputs.",
    "objective": "Preserve requirement, plan, task, contract, and verification references in Context Pack and ExecPlan v2 without requiring Spec Kit for normal ae-framework usage.",
    "sourceReferences": [
      {
        "kind": "issue",
        "id": "#3550",
        "url": "https://github.com/itdojp/ae-framework/issues/3550",
        "description": "Source Issue for Spec Kit bridge work."
      },
      {
        "kind": "spec-kit",
        "id": "001-reservation-approval",
        "path": "fixtures/spec-kit/greenfield/specs/001-reservation-approval",
        "description": "Spec Kit feature directory."
      },
      {
        "kind": "document",
        "id": "spec-kit-upstream",
        "description": "GitHub Spec Kit upstream workflow and templates."
      }
    ],
    "nonGoals": [
      "Do not vendor or fork GitHub Spec Kit.",
      "Do not execute Spec Kit agent commands or task-to-issues side effects.",
      "Do not make bridge findings blocking in this preview issue."
    ]
  },
  "scope": {
    "inScope": [
      "Read Spec Kit feature artifacts and emit ae-framework-compatible report-only artifacts.",
      "Map requirements, plans, tasks, contracts, and verification references into Context Pack and ExecPlan v2 surfaces."
    ],
    "outOfScope": [
      "Hosted orchestrator implementation.",
      "Spec Kit command execution or GitHub Issue creation.",
      "Policy-gate enforcement changes."
    ],
    "targetFiles": [
      {
        "path": "fixtures/spec-kit/greenfield/specs/001-reservation-approval/spec.md",
        "changeType": "read-only",
        "reason": "spec source consumed by the bridge importer."
      },
      {
        "path": "fixtures/spec-kit/greenfield/specs/001-reservation-approval/plan.md",
        "changeType": "read-only",
        "reason": "plan source consumed by the bridge importer."
      },
      {
        "path": "fixtures/spec-kit/greenfield/specs/001-reservation-approval/tasks.md",
        "changeType": "read-only",
        "reason": "tasks source consumed by the bridge importer."
      },
      {
        "path": "fixtures/spec-kit/greenfield/.specify/memory/constitution.md",
        "changeType": "read-only",
        "reason": "constitution source consumed by the bridge importer."
      },
      {
        "path": "fixtures/spec-kit/greenfield/specs/001-reservation-approval/contracts/reservation-api.openapi.yaml",
        "changeType": "read-only",
        "reason": "contract source consumed by the bridge importer."
      }
    ],
    "affectedContracts": [
      {
        "contractId": "spec-kit-bridge-report",
        "schemaPath": "schema/spec-kit-bridge-report.schema.json",
        "lifecycle": "preview",
        "reason": "New report-only bridge artifact emitted by the importer."
      },
      {
        "contractId": "context-pack-v1",
        "schemaPath": "schema/context-pack-v1.schema.json",
        "lifecycle": "stable",
        "reason": "Bridge emits a fixture-compatible Context Pack import artifact."
      },
      {
        "contractId": "exec-plan.v2",
        "schemaPath": "schema/exec-plan.v2.schema.json",
        "lifecycle": "preview",
        "reason": "Bridge emits a fixture-compatible ExecPlan v2 import artifact."
      }
    ]
  },
  "context": {
    "contextPackRefs": [
      {
        "kind": "context-pack",
        "refId": "spec-kit-001-reservation-approval-context-pack",
        "path": "fixtures/spec-kit/greenfield/expected/context-pack.import.json",
        "description": "Generated Context Pack import artifact."
      }
    ],
    "assuranceRefs": {
      "mode": "report-only",
      "profiles": [],
      "claimRefs": [
        "FR-001",
        "FR-002",
        "FR-003"
      ],
      "summaryArtifacts": [
        "artifacts/assurance/assurance-summary.json"
      ]
    },
    "specKitRefs": [
      {
        "kind": "spec-kit-spec",
        "refId": "001-reservation-approval.spec",
        "path": "fixtures/spec-kit/greenfield/specs/001-reservation-approval/spec.md",
        "description": "Spec Kit feature specification."
      },
      {
        "kind": "spec-kit-plan",
        "refId": "001-reservation-approval.plan",
        "path": "fixtures/spec-kit/greenfield/specs/001-reservation-approval/plan.md",
        "description": "Spec Kit implementation plan."
      },
      {
        "kind": "spec-kit-task",
        "refId": "001-reservation-approval.tasks",
        "path": "fixtures/spec-kit/greenfield/specs/001-reservation-approval/tasks.md",
        "description": "Spec Kit generated task list."
      },
      {
        "kind": "artifact-contract",
        "refId": "contract.reservation-api-openapi",
        "path": "fixtures/spec-kit/greenfield/specs/001-reservation-approval/contracts/reservation-api.openapi.yaml",
        "description": "Spec Kit contract artifact (openapi)."
      }
    ]
  },
  "taskGraph": {
    "nodes": [
      {
        "id": "task.import-spec-kit",
        "title": "Import Spec Kit feature artifacts",
        "kind": "analysis",
        "owner": "agent",
        "status": "planned",
        "dependsOn": [],
        "evidenceRequirementRefs": [
          "ev.spec-kit-bridge-report"
        ],
        "commands": [
          {
            "id": "cmd.spec-kit-import",
            "command": "pnpm run spec-kit:import-feature -- --feature-dir fixtures/spec-kit/greenfield/specs/001-reservation-approval --output-dir artifacts/spec-kit",
            "purpose": "Generate bridge report, Context Pack import, and ExecPlan v2 import artifacts.",
            "when": "local-validation",
            "expectedArtifactRefs": [
              "artifact.spec-kit-bridge-report",
              "artifact.context-pack-import",
              "artifact.exec-plan-v2-import"
            ]
          }
        ],
        "outputArtifactRefs": [
          "artifact.spec-kit-bridge-report",
          "artifact.context-pack-import",
          "artifact.exec-plan-v2-import"
        ]
      },
      {
        "id": "task.t001",
        "title": "Create reservation approval fixture directory and schema references",
        "kind": "implementation",
        "owner": "either",
        "status": "planned",
        "dependsOn": [
          "task.import-spec-kit"
        ],
        "evidenceRequirementRefs": [
          "ev.spec-kit-bridge-report",
          "ev.context-pack-import",
          "ev.exec-plan-v2-import"
        ],
        "commands": [],
        "outputArtifactRefs": [
          "artifact.spec-kit-bridge-report"
        ]
      },
      {
        "id": "task.t002",
        "title": "Add bridge report validation command to local verification",
        "kind": "implementation",
        "owner": "either",
        "status": "planned",
        "dependsOn": [
          "task.t001"
        ],
        "evidenceRequirementRefs": [
          "ev.spec-kit-bridge-report",
          "ev.context-pack-import",
          "ev.exec-plan-v2-import"
        ],
        "commands": [],
        "outputArtifactRefs": [
          "artifact.spec-kit-bridge-report"
        ]
      },
      {
        "id": "task.t003",
        "title": "Define approval event contract in contracts/reservation-api.openapi.yaml",
        "kind": "implementation",
        "owner": "either",
        "status": "planned",
        "dependsOn": [
          "task.t002"
        ],
        "evidenceRequirementRefs": [
          "ev.spec-kit-bridge-report",
          "ev.context-pack-import",
          "ev.exec-plan-v2-import"
        ],
        "commands": [],
        "outputArtifactRefs": [
          "artifact.spec-kit-bridge-report"
        ]
      },
      {
        "id": "task.t004",
        "title": "Implement approval state transition for sufficient stock",
        "kind": "implementation",
        "owner": "either",
        "status": "planned",
        "dependsOn": [
          "task.t003"
        ],
        "evidenceRequirementRefs": [
          "ev.spec-kit-bridge-report",
          "ev.context-pack-import",
          "ev.exec-plan-v2-import"
        ],
        "commands": [],
        "outputArtifactRefs": [
          "artifact.spec-kit-bridge-report"
        ]
      },
      {
        "id": "task.t005",
        "title": "Add automated approval scenario test",
        "kind": "verification",
        "owner": "either",
        "status": "planned",
        "dependsOn": [
          "task.t004"
        ],
        "evidenceRequirementRefs": [
          "ev.spec-kit-bridge-report",
          "ev.context-pack-import",
          "ev.exec-plan-v2-import"
        ],
        "commands": [],
        "outputArtifactRefs": [
          "artifact.spec-kit-bridge-report"
        ]
      },
      {
        "id": "task.t006",
        "title": "Implement rejection path for insufficient stock",
        "kind": "implementation",
        "owner": "either",
        "status": "planned",
        "dependsOn": [
          "task.t005"
        ],
        "evidenceRequirementRefs": [
          "ev.spec-kit-bridge-report",
          "ev.context-pack-import",
          "ev.exec-plan-v2-import"
        ],
        "commands": [],
        "outputArtifactRefs": [
          "artifact.spec-kit-bridge-report"
        ]
      },
      {
        "id": "task.t007",
        "title": "Add automated rejection scenario test",
        "kind": "verification",
        "owner": "either",
        "status": "planned",
        "dependsOn": [
          "task.t006"
        ],
        "evidenceRequirementRefs": [
          "ev.spec-kit-bridge-report",
          "ev.context-pack-import",
          "ev.exec-plan-v2-import"
        ],
        "commands": [],
        "outputArtifactRefs": [